{
  "format": "scenerig/1",
  "id": "character-brunette",
  "title": "Brunette (Ready Player Me)",
  "family": "human",
  "archetype": "humanoid",
  "geometry": {
    "file": "brunette.glb",
    "sha256": "8864c504b5c11daa2f0037afffdc0815bb0fa2e6062e37a584746116a3c2f538",
    "units": "m",
    "up": "Y",
    "facing": "+Z",
    "tris": 13317
  },
  "rest": {
    "pose": "A",
    "origin": "feet"
  },
  "bones": {
    "canonical": true,
    "map": {
      "Hips": "hips",
      "Spine": "spine",
      "Spine1": "spine1",
      "Spine2": "chest",
      "Neck": "neck",
      "Head": "head",
      "HeadTop_End": "headTop",
      "LeftEye": "eye.L",
      "RightEye": "eye.R",
      "LeftShoulder": "shoulder.L",
      "LeftArm": "upperArm.L",
      "LeftForeArm": "lowerArm.L",
      "LeftHand": "hand.L",
      "LeftHandThumb1": "thumb1.L",
      "LeftHandThumb2": "thumb2.L",
      "LeftHandThumb3": "thumb3.L",
      "LeftHandThumb4": "thumb4.L",
      "LeftHandIndex1": "index1.L",
      "LeftHandIndex2": "index2.L",
      "LeftHandIndex3": "index3.L",
      "LeftHandIndex4": "index4.L",
      "LeftHandMiddle1": "middle1.L",
      "LeftHandMiddle2": "middle2.L",
      "LeftHandMiddle3": "middle3.L",
      "LeftHandMiddle4": "middle4.L",
      "LeftHandRing1": "ring1.L",
      "LeftHandRing2": "ring2.L",
      "LeftHandRing3": "ring3.L",
      "LeftHandRing4": "ring4.L",
      "LeftHandPinky1": "pinky1.L",
      "LeftHandPinky2": "pinky2.L",
      "LeftHandPinky3": "pinky3.L",
      "LeftHandPinky4": "pinky4.L",
      "RightShoulder": "shoulder.R",
      "RightArm": "upperArm.R",
      "RightForeArm": "lowerArm.R",
      "RightHand": "hand.R",
      "RightHandThumb1": "thumb1.R",
      "RightHandThumb2": "thumb2.R",
      "RightHandThumb3": "thumb3.R",
      "RightHandThumb4": "thumb4.R",
      "RightHandIndex1": "index1.R",
      "RightHandIndex2": "index2.R",
      "RightHandIndex3": "index3.R",
      "RightHandIndex4": "index4.R",
      "RightHandMiddle1": "middle1.R",
      "RightHandMiddle2": "middle2.R",
      "RightHandMiddle3": "middle3.R",
      "RightHandMiddle4": "middle4.R",
      "RightHandRing1": "ring1.R",
      "RightHandRing2": "ring2.R",
      "RightHandRing3": "ring3.R",
      "RightHandRing4": "ring4.R",
      "RightHandPinky1": "pinky1.R",
      "RightHandPinky2": "pinky2.R",
      "RightHandPinky3": "pinky3.R",
      "RightHandPinky4": "pinky4.R",
      "LeftUpLeg": "upperLeg.L",
      "LeftLeg": "lowerLeg.L",
      "LeftFoot": "foot.L",
      "LeftToeBase": "toe.L",
      "LeftToe_End": "toeEnd.L",
      "RightUpLeg": "upperLeg.R",
      "RightLeg": "lowerLeg.R",
      "RightFoot": "foot.R",
      "RightToeBase": "toe.R",
      "RightToe_End": "toeEnd.R"
    },
    "extra": []
  },
  "face": {
    "morphs": [
      "mouthOpen",
      "viseme_sil",
      "viseme_PP",
      "viseme_FF",
      "viseme_TH",
      "viseme_DD",
      "viseme_kk",
      "viseme_CH",
      "viseme_SS",
      "viseme_nn",
      "viseme_RR",
      "viseme_aa",
      "viseme_E",
      "viseme_I",
      "viseme_O",
      "viseme_U",
      "mouthSmile",
      "browDownLeft",
      "browDownRight",
      "browInnerUp",
      "browOuterUpLeft",
      "browOuterUpRight",
      "eyeSquintLeft",
      "eyeSquintRight",
      "eyeWideLeft",
      "eyeWideRight",
      "jawForward",
      "jawLeft",
      "jawRight",
      "mouthFrownLeft",
      "mouthFrownRight",
      "mouthPucker",
      "mouthShrugLower",
      "mouthShrugUpper",
      "noseSneerLeft",
      "noseSneerRight",
      "mouthLowerDownLeft",
      "mouthLowerDownRight",
      "mouthLeft",
      "mouthRight",
      "eyeLookDownLeft",
      "eyeLookDownRight",
      "eyeLookUpLeft",
      "eyeLookUpRight",
      "eyeLookInLeft",
      "eyeLookInRight",
      "eyeLookOutLeft",
      "eyeLookOutRight",
      "cheekPuff",
      "cheekSquintLeft",
      "cheekSquintRight",
      "jawOpen",
      "mouthClose",
      "mouthFunnel",
      "mouthDimpleLeft",
      "mouthDimpleRight",
      "mouthStretchLeft",
      "mouthStretchRight",
      "mouthRollLower",
      "mouthRollUpper",
      "mouthPressLeft",
      "mouthPressRight",
      "mouthUpperUpLeft",
      "mouthUpperUpRight",
      "mouthSmileLeft",
      "mouthSmileRight",
      "tongueOut",
      "eyeBlinkLeft",
      "eyeBlinkRight",
      "eyesClosed",
      "eyesLookUp",
      "eyesLookDown"
    ],
    "visemes": "oculus-15",
    "engine_map": "scene-10"
  },
  "sockets": [],
  "clips": [],
  "license": {
    "name": "Ready Player Me (free avatar)",
    "author": "Ready Player Me",
    "source": "https://readyplayer.me"
  },
  "tags": [
    "human",
    "humanoid"
  ]
}
